12:49:14.704617 IP 172.18.5.117.ssh > 113.90.237.181.53271: Flags [P.], seq 3456583025:3456583237, ack 1070994822, win 251, length 212
12:49:14.760911 IP 113.90.237.181.53271 > 172.18.5.117.ssh: Flags [.], ack 212, win 2052, length 0
12:49:15.202821 IP 113.90.237.181.52022 > 172.18.5.117.ssh: Flags [P.], seq 1468010903:1468010955, ack 2028171429, win 2052, length 52
12:49:15.202874 IP 172.18.5.117.ssh > 113.90.237.181.52022: Flags [.], ack 52, win 448, length 0
12:49:15.700640 IP 172.18.5.117.46641 > 100.100.2.136.domain: 27338+ PTR? 181.237.90.113.in-addr.arpa. (45)
12:49:15.767913 IP 100.100.2.136.domain > 172.18.5.117.46641: 27338 NXDomain 0/1/0 (134)
12:49:15.768274 IP 172.18.5.117.41992 > 100.100.2.136.domain: 3727+ PTR? 117.5.18.172.in-addr.arpa. (43)
12:49:15.768474 IP 100.100.2.136.domain > 172.18.5.117.41992: 3727 NXDomain* 0/1/0 (97)
12:49:16.700437 IP 172.18.5.117.39182 > 100.100.2.138.domain: 740+ PTR? 136.2.100.100.in-addr.arpa. (44)
12:49:16.700661 IP 100.100.2.138.domain > 172.18.5.117.39182: 740 NXDomain* 0/1/0 (99)
12:49:17.267322 IP 119.136.115.122.50963 > 172.18.5.117.ssh: Flags [P.], seq 1042248698:1042248750, ack 3674982671, win 2053, length 52
12:49:17.267372 IP 172.18.5.117.ssh > 119.136.115.122.50963: Flags [.], ack 52, win 317, length 0
12:49:17.700464 IP 172.18.5.117.59989 > 100.100.2.138.domain: 2750+ PTR? 138.2.100.100.in-addr.arpa. (44)
12:49:17.700676 IP 100.100.2.138.domain > 172.18.5.117.59989: 2750 NXDomain* 0/1/0 (99)
12:49:17.700908 IP 172.18.5.117.56644 > 100.100.2.136.domain: 63130+ PTR? 122.115.136.119.in-addr.arpa. (46)
12:49:17.713540 IP 100.100.2.136.domain > 172.18.5.117.56644: 63130 NXDomain 0/1/0 (104)
12:49:18.515168 IP 113.90.238.123.53734 > 172.18.5.117.ssh: Flags [P.], seq 4270131967:4270132019, ack 1386201942, win 254, length 52
12:49:18.515221 IP 172.18.5.117.ssh > 113.90.238.123.53734: Flags [.], ack 52, win 251, length 0
12:49:18.700499 IP 172.18.5.117.34013 > 100.100.2.138.domain: 36440+ PTR? 123.238.90.113.in-addr.arpa. (45)
12:49:18.768470 IP 100.100.2.138.domain > 172.18.5.117.34013: 36440 NXDomain 0/1/0 (134)
12:49:20.608934 IP 113.90.237.181.53271 > 172.18.5.117.ssh: Flags [P.], seq 1:53, ack 212, win 2052, length 52
12:49:20.648220 IP 172.18.5.117.ssh > 113.90.237.181.53271: Flags [.], ack 53, win 251, length 0
12:49:23.689921 IP 172.18.5.117.ntp > 100.100.5.3.ntp: NTPv4, Client, length 48

